{
  "schemaVersion": 1,
  "contractId": "channel-fixture",
  "fixtureId": "tokens-27000-vocab-8000",
  "tokenCount": 27000,
  "vocabularySize": 8000,
  "source": {
    "artifactType": "source-text",
    "byteLength": 1000,
    "sha256": "1111111111111111111111111111111111111111111111111111111111111111"
  },
  "opaqueShard": {
    "artifactType": "opaque-shard",
    "byteLength": 2000,
    "sha256": "2222222222222222222222222222222222222222222222222222222222222222"
  },
  "commonInputs": [
    {
      "artifactType": "reference-corpus",
      "byteLength": 3000,
      "sha256": "3333333333333333333333333333333333333333333333333333333333333333"
    }
  ],
  "normalizationVersion": "1.0.0"
}
